name,admission_year,form_of_study,exams_score,certificate_score,admission_score,faculty_name,faculty_short_name,specialty,address,phone
Блинов Демид Федосеевич,2022,дневная,184,7.8,262,Факультет социокультурных коммуникаций,ФСК,Социально-культурный менеджмент и коммуникации,"г. Уфа, пр. Малый, д. 9/7 стр. 8/6, 103507",8 (130) 033-7085
Большакова София Константиновна,2024,дневная,283,8.8,371,Механико-математический факультет,ММФ,Математика и компьютерные науки,"к. Белокуриха, ул. Саратовская, д. 69 стр. 1/9, 495697",+74831933818
Валерия Натановна Юдина,2024,дневная,198,7.0,268,Химический факультет,Химфак,Химия высоких энергий,"ст. Сладково, ул. Нефтяников, д. 8/7, 438973",+77628863052
Павлова Агата Константиновна,2024,дневная,244,8.6,330,Факультет журналистики,Журфак,Журналистика,"ст. Сосновый Бор, ул. Прохладная, д. 4/8, 310540",8 (940) 648-73-40
Стоян Евсеевич Крылов,2020,дневная,286,9.0,376,Факультет прикладной математики и информатики,ФПМИ,Информатика,"г. Городовиковск, пер. Карла Либкнехта, д. 8 стр. 4/8, 153778",+7 (540) 223-8798
Мельников Константин Ярославович,2021,дневная,241,7.0,311,Филологический факультет,Филфак,Русская филология,"клх Владимир, наб. Севастопольская, д. 3 к. 566, 223148",+7 (827) 282-5712
Шубин Степан Жоресович,2020,дневная,275,10.0,375,Институт теологии им. святых Мефодия и Кирилла,Институт теологии,Теология,"д. Прохладный, пр. Докучаева, д. 291 к. 240, 437443",+7 (373) 611-5152
Валентина Павловна Макарова,2023,дневная,184,7.5,259,Факультет философии и социальных наук,ФФСН,Социология,"г. Юрюзань, алл. Партизанская, д. 380 к. 1, 639663",+7 (702) 654-0974
Герасимова Феврония Вениаминовна,2020,дневная,294,9.5,389,Физический факультет,Физфак,Прикладная физика,"г. Джубга, пр. Фадеева, д. 2 стр. 9/4, 119276",+7 759 584 81 70
Корнил Бориславович Попов,2021,дневная,242,9.6,338,Исторический факультет,Истфак,Музейное дело и охрана историко-культурного наследия,"д. Белорецк, алл. Бригадная, д. 1/1, 901890",8 (562) 563-55-51
Анастасия Кирилловна Маслова,2023,дневная,283,9.6,379,Механико-математический факультет,ММФ,Математика и компьютерные науки,"с. Темрюк, наб. Подгорная, д. 112 к. 8, 570348",+74849325540
Фомичева Нонна Матвеевна,2021,дневная,190,9.2,282,Институт теологии им. святых Мефодия и Кирилла,Институт теологии,Теология,"д. Билибино, пр. Моховой, д. 8/4, 855956",+7 680 555 4358
Нестеров Модест Феодосьевич,2024,дневная,234,8.9,323,Экономический факультет,Экономфак,Международная экономика и торговля (с углубленным изучением китайского языка),"к. Назрань, пер. Колхозный, д. 807, 338936",87036924774
Некрасова Алла Алексеевна,2023,дневная,236,9.2,328,Филологический факультет,Филфак,"Романо-германская филология (английская, французская, немецкая, итальянская)","д. Мезень, пер. Просторный, д. 43 стр. 8, 452611",+7 (190) 510-7651
Никонова Евдокия Григорьевна,2023,второе высшее образование,269,8.2,351,Факультет философии и социальных наук,ФФСН,Психология,"ст. Сергиев Посад, пр. Западный, д. 6 стр. 38, 213648",8 (865) 001-99-36
Феликс Артурович Шилов,2023,заочная сокращенный срок,198,7.3,271,Исторический факультет,Истфак,Управление документами,"к. Верхнее Пенжино, наб. 70 лет Октября, д. 465, 393882",+7 (472) 739-82-48
Исаев Герман Ануфриевич,2021,дневная,189,7.3,262,Факультет географии и геоинформатики,ФГиГ,Космоаэрокартография и геодезия,"г. Ростов, ш. Фурманова, д. 1 стр. 2/1, 300450",8 368 646 37 27
Гордеева Анжела Александровна,2021,дневная,195,7.1,266,Физический факультет,Физфак,Ядерные физика и технологии,"с. Чермоз, ул. Путевая, д. 7/5 стр. 651, 902572",+7 417 417 96 35
Эмилия Натановна Алексеева,2021,дневная,273,8.0,353,Биологический факультет,Биофак,Биохимия,"п. Каргополь, пр. Пионерский, д. 6 стр. 29, 875807",+7 322 575 5419
Маркова Марфа Афанасьевна,2022,дневная,282,8.7,369,Биологический факультет,Биофак,Фундаментальная и прикладная биотехнология,"с. Златоуст, алл. Просторная, д. 4/1, 126554",+7 620 757 79 84
Юдин Варлаам Изотович,2023,дневная,295,7.2,367,Факультет географии и геоинформатики,ФГиГ,Геоинформационные системы,"к. Александровск-Сахалинский, пр. Курчатова, д. 29 стр. 311, 907105",8 (381) 381-9597
Андрон Анисимович Дементьев,2024,заочная сокращенный срок,248,9.3,341,Исторический факультет,Истфак,Управление документами,"с. Яр-Сале, ул. Светлая, д. 8/5, 441960",+7 (089) 417-8537
Симонов Исидор Захарьевич,2024,дневная,300,9.2,392,Филологический факультет,Филфак,Русская филология,"к. Вытегра, наб. Мелиоративная, д. 4/2 к. 9/7, 904759",+7 986 875 34 00
Вероника Наумовна Ковалева,2023,дневная,211,7.5,286,Физический факультет,Физфак,Компьютерная физика,"с. Павловская, ш. Отрадное, д. 87, 572503",+74769804722
Сорокина Ираида Анатольевна,2022,дневная,232,8.9,321,Военный факультет,Военфак,"Химия (радиационная, химическая и биологическая защита)","к. Уэлен, пер. Садовый, д. 3/7, 540058",+7 (757) 646-4062
Никонов Богдан Филимонович,2021,заочная,188,9.1,279,Биологический факультет,Биофак,Биохимия,"д. Объячево, пер. Раздольный, д. 887, 857523",85007317231
Борислав Авдеевич Жуков,2020,дневная,209,8.0,289,Факультет прикладной математики и информатики,ФПМИ,Кибербезопасность,"ст. Быково (метеост.), пр. Бульварный, д. 621 к. 460, 450903",+72844524588
Марфа Григорьевна Данилова,2023,дневная,297,8.1,378,Исторический факультет,Истфак,История,"д. Адыгейск, алл. Радужная, д. 28, 584485",+7 443 780 6063
Галина Васильевна Силина,2023,дневная,240,9.7,337,Экономический факультет,Экономфак,Менеджмент,"д. Курск, ш. Хвойное, д. 1/6 к. 1, 759354",82115344443
Сократ Теймуразович Беляков,2021,дневная,251,9.7,348,Институт теологии им. святых Мефодия и Кирилла,Институт теологии,Теология,"с. Бологое, пер. Никитина, д. 797 стр. 6, 777620",80543048664
Пахомов Елизар Антипович,2021,дневная,281,8.9,370,Юридический факультет,Юрфак,Экономическое право,"к. Армавир, пр. Никитина, д. 502 к. 172, 464131",8 424 682 1678
Андроник Ермилович Миронов,2021,дневная,183,7.3,256,Факультет географии и геоинформатики,ФГиГ,Геотехнологии туризма и экскурсионная деятельность,"г. Дагомыс, наб. Запрудная, д. 1/4 к. 95, 472215",8 335 764 1350
Тарас Иосифович Доронин,2020,дневная,202,9.5,297,Факультет международных отношений,ФМО,Менеджмент,"с. Югорск, бул. Водников, д. 70 к. 14, 005177",8 195 497 27 02
Фролова Пелагея Кирилловна,2022,дневная,234,7.7,311,Химический факультет,Химфак,Фундаментальная химия,"п. Сунтар, пр. Железнодорожный, д. 7/7 к. 20, 203876",8 951 840 7340
Маргарита Аркадьевна Корнилова,2022,дневная,281,9.3,374,Факультет социокультурных коммуникаций,ФСК,Дизайн предметно-пространственной среды,"п. Югорск, ш. Докучаева, д. 9/3 к. 1/7, 068062",8 (632) 043-26-60
София Яковлевна Лихачева,2022,дневная,299,8.6,385,Институт теологии им. святых Мефодия и Кирилла,Институт теологии,Теология,"г. Звенигород, алл. Гастелло, д. 1 стр. 5/2, 796999",8 (941) 615-50-09
Александров Виссарион Юльевич,2020,заочная,263,8.9,352,Биологический факультет,Биофак,Биология,"д. Агата, алл. Гвардейская, д. 6 к. 1, 739842",+7 (533) 213-17-28
Феоктист Елизарович Яковлев,2021,дневная,277,8.1,358,Юридический факультет,Юрфак,Правоведение,"п. Липецк, ул. Красноярская, д. 1/2, 414262",+7 (519) 699-79-49
Тимофеева Наина Леоновна,2020,второе высшее образование,215,7.9,294,Факультет философии и социальных наук,ФФСН,Психология,"к. Северобайкальск, пер. Средний, д. 68, 197365",+7 (390) 722-8739
Никитин Ростислав Геннадиевич,2020,дневная,240,7.6,316,Физический факультет,Физфак,Прикладная физика,"г. Кабанск, наб. Лазо, д. 1 к. 50, 782973",8 400 255 28 12
Селезнев Ладимир Викентьевич,2023,дневная,294,8.7,381,Факультет журналистики,Журфак,Журналистика,"с. Гдов, бул. Вишневый, д. 2/8, 001197",+7 (824) 483-6482
Мария Ефимовна Никитина,2021,дневная,187,9.5,282,Юридический факультет,Юрфак,Правоведение,"ст. Ноглики, алл. Донская, д. 543 к. 9, 842100",+71772843322
Вадим Фёдорович Андреев,2021,дневная,277,7.7,354,Экономический факультет,Экономфак,Государственный аудит,"к. Плесецк, ш. Профсоюзное, д. 4, 193411",86657788947
Копылова Алла Викторовна,2022,дневная,248,7.5,323,Филологический факультет,Филфак,Восточная филология,"с. Семлячики, пр. Циолковского, д. 8/3, 315585",8 573 904 0811
Венедикт Феофанович Шестаков,2023,дневная,238,7.4,312,Факультет международных отношений,ФМО,Африканистика,"п. Углич, ул. Черемуховая, д. 47 к. 160, 873141",+7 (693) 901-2416
Лобанов Остромир Ильич,2021,дневная,189,8.5,274,Военный факультет,Военфак,Международные отношения (специализация – международные отношения в информационной сфере),"д. Чита, алл. Абрикосовая, д. 41 стр. 146, 078832",+7 559 243 3027
Щербаков Венедикт Измаилович,2023,дневная,278,7.2,350,Экономический факультет,Экономфак,Экономическая безопасность,"с. Ярославль, наб. Подгорная, д. 548 стр. 8/7, 295626",8 (581) 305-8021
Исакова Лукия Антоновна,2022,дневная,251,8.1,332,Юридический факультет,Юрфак,Правоведение,"к. Беломорск, пр. Володарского, д. 7/1 к. 4, 756777",8 705 136 49 46
Любовь Вадимовна Смирнова,2020,дневная,199,9.4,293,Экономический факультет,Экономфак,Экономика,"клх Югорск, ш. Терешковой, д. 5, 467405",+7 835 342 03 52
Вишняков Аким Изотович,2024,дневная сокращенный срок,202,9.2,294,Юридический факультет,Юрфак,Правоведение,"с. Ахтубинск, пер. Леонова, д. 35 стр. 6, 915767",+7 (723) 280-2911
Виноградов Никифор Гурьевич,2022,дневная,202,9.8,300,Факультет философии и социальных наук,ФФСН,Социальные коммуникации,"ст. Уренгой, пр. Карьерный, д. 445, 397918",8 (203) 745-6379
Гаврилова Алина Геннадьевна,2021,дневная,246,9.2,338,Военный факультет,Военфак,Правоведение (специализация - юрисконсультская работа в военной сфере),"г. Данков, ш. Пограничное, д. 53, 313031",+78854225516
Мария Аскольдовна Михеева,2023,дневная,270,8.5,355,Факультет журналистики,Журфак,Информация и коммуникация,"г. Джейрах, пер. Черемуховый, д. 5/3, 559032",8 090 438 0675
Алина Евгеньевна Меркушева,2021,дневная,207,7.5,282,Факультет философии и социальных наук,ФФСН,Социология,"с. Сосногорск, пр. Пригородный, д. 742 стр. 3, 363239",+7 039 048 98 09
Фомичева Анастасия Андреевна,2024,дневная,191,8.1,272,Исторический факультет,Истфак,Музейное дело и охрана историко-культурного наследия,"ст. Ивдель, пер. Космодемьянской, д. 8/8, 891968",8 686 385 42 55
Кудрявцева Нонна Константиновна,2020,дневная,184,9.0,274,Экономический факультет,Экономфак,Государственный аудит,"к. Сеймчан, наб. Транспортная, д. 3/8 к. 773, 143593",8 (381) 922-15-96
Ефрем Юлианович Миронов,2020,дневная,278,7.0,348,Физический факультет,Физфак,Прикладная физика,"с. Шелагонцы, наб. Ярославская, д. 71 к. 321, 711716",+7 859 712 0735
Агата Даниловна Селезнева,2023,дневная,208,8.6,294,Химический факультет,Химфак,Химия,"д. Тулпан, ул. Шевченко, д. 163, 087344",8 506 887 0822
Громов Никандр Андреевич,2023,дневная,291,8.0,371,Юридический факультет,Юрфак,Экономическое право,"клх Нижний Тагил, ш. Дружба, д. 13, 957648",+78795163285
Жуков Юлиан Александрович,2022,заочная,288,8.8,376,Биологический факультет,Биофак,Биохимия,"г. Дубна, бул. Шмидта, д. 3/5 к. 10, 259064",+7 (117) 646-26-51
Никифорова Алина Григорьевна,2020,дневная,258,9.7,355,Филологический факультет,Филфак,Восточная филология,"п. Артем, ул. Боровая, д. 7 к. 83, 088244",+7 (737) 647-6527
Гурьева Агафья Юльевна,2024,дневная,296,7.9,375,Физический факультет,Физфак,Компьютерная физика,"с. Пенза, бул. Больничный, д. 8 к. 181, 928827",8 (056) 087-8991
Соболев Юлий Фёдорович,2024,дневная,184,9.6,280,Совместный институт БГУ и Даляньского политехнического университета,СИБД,Механика и математическое моделирование,"ст. Онега, пр. Терешковой, д. 25 к. 2/6, 377821",8 (733) 958-2255
Бобров Спиридон Феоктистович,2023,дневная,217,8.5,302,Факультет радиофизики и компьютерных технологий,РФиКТ,Кибербезопасность,"к. Ивдель, пр. Крылова, д. 86 к. 3/5, 463991",+7 973 455 45 76
Лазарев Андроник Августович,2023,дневная,270,7.3,343,Механико-математический факультет,ММФ,Компьютерная математика и системный анализ,"г. Юрюзань, пр. Глинки, д. 246 к. 8, 029463",+7 292 829 3493
Орехова Ангелина Леонидовна,2020,дневная,186,10.0,286,Физический факультет,Физфак,Фундаментальная физика,"с. Анива, бул. Поперечный, д. 7/9 стр. 878, 682290",8 (642) 518-22-26
Лора Макаровна Кириллова,2020,второе высшее образование,269,9.4,363,Факультет философии и социальных наук,ФФСН,Психология,"с. Калачинск, наб. Коммунистическая, д. 7/7 к. 1/1, 008658",+7 (456) 762-7421
Беляев Сергей Теймуразович,2022,дневная,217,7.1,288,Факультет радиофизики и компьютерных технологий,РФиКТ,Прикладная информатика,"п. Нижневартовск, пр. Инженерный, д. 934, 031566",+7 (699) 773-6976
Тетерина Наталья Матвеевна,2020,дневная,271,9.3,364,Факультет журналистики,Журфак,Информация и коммуникация,"клх Щельяюр, пр. Урожайный, д. 7, 975867",+77594736346
Галина Робертовна Носова,2023,дневная,251,8.5,336,Совместный институт БГУ и Даляньского политехнического университета,СИБД,Мировая экономика,"п. Находка, бул. Короленко, д. 6 к. 63, 752253",8 (657) 071-05-25
Давыд Федосеевич Ефремов,2020,дневная,261,8.1,342,Экономический факультет,Экономфак,Менеджмент,"к. Хасан, пер. Ворошилова, д. 36 стр. 799, 783485",+7 445 873 36 73
Мария Геннадиевна Горбачева,2023,второе высшее образование,289,7.5,364,Факультет философии и социальных наук,ФФСН,Психология,"к. Юрьевец (Иван.), бул. Лесхозный, д. 481 стр. 69, 073870",8 150 932 70 17
Комиссаров Кондрат Аверьянович,2022,дневная,295,7.5,370,Юридический факультет,Юрфак,Правоведение,"клх Яшкуль, ул. Кошевого, д. 1 к. 8, 414882",8 160 917 6485
Филиппов Сократ Ефимьевич,2024,дневная,275,9.4,369,Факультет прикладной математики и информатики,ФПМИ,Прикладная информатика,"г. Рыбинск, ул. Овражная, д. 49 к. 546, 725498",82176101495
Раиса Анатольевна Савельева,2023,дневная,230,8.3,313,Филологический факультет,Филфак,Славянская филология (с русским языком обучения),"ст. Горячинск, наб. Жуковского, д. 267, 277580",+7 (070) 293-64-86
Белозерова Раиса Эдуардовна,2021,дневная,271,8.1,352,Химический факультет,Химфак,Химия высоких энергий,"клх Владимир, ш. Беляева, д. 50 стр. 9/8, 439192",+7 909 305 63 43
Мария Яковлевна Брагина,2023,дневная,180,8.3,263,Военный факультет,Военфак,"Химия (радиационная, химическая и биологическая защита)","к. Лабытнанги, алл. Полтавская, д. 15 стр. 22, 121110",8 (016) 117-77-16
г-н Дементьев Семен Фадеевич,2024,дневная,249,8.6,335,Факультет философии и социальных наук,ФФСН,Социология,"ст. Красноуфимск, пер. Щорса, д. 4 к. 7, 252556",8 843 201 91 10
Ираклий Эдгарович Куликов,2024,дневная,185,7.3,258,Факультет международных отношений,ФМО,Африканистика,"д. Сергиев Посад, ш. Кубанское, д. 275, 950293",+7 711 538 9972
Ираклий Валерьевич Яковлев,2020,дневная,199,8.8,287,Физический факультет,Физфак,Прикладная физика,"клх Малгобек, алл. Окружная, д. 1, 072046",89233124539
Эраст Викентьевич Шаров,2021,дневная,228,8.9,317,Факультет международных отношений,ФМО,Мировая экономика,"п. Южноуральск, пр. Кирова, д. 1, 573731",+7 (849) 009-7050
Антонина Степановна Рябова,2020,дневная,276,9.2,368,Механико-математический факультет,ММФ,Математика,"с. Качканар, алл. Уральская, д. 21, 700445",+7 008 479 43 74
Яков Валерьянович Туров,2023,дневная,215,8.4,299,Исторический факультет,Истфак,История,"с. Кемерово, ул. Нижняя, д. 82 к. 258, 561641",8 (621) 309-55-83
Денисов Михаил Игнатович,2020,дневная,292,9.7,389,Факультет журналистики,Журфак,Информация и коммуникация,"клх Шахты, пр. Чайкиной, д. 331 к. 962, 458121",+7 597 696 5839
Венедикт Устинович Гришин,2023,дневная,272,8.5,357,Экономический факультет,Экономфак,Международная экономика и торговля (с углубленным изучением китайского языка),"д. Серов, наб. Шишкина, д. 17 к. 493, 418112",+7 (934) 728-2709
Гущин Виктор Тимурович,2024,дневная,206,7.5,281,Физический факультет,Физфак,Фундаментальная физика,"д. Луга, ул. Луговая, д. 2 к. 763, 453360",+76499402623
Гаврилова Майя Валериевна,2023,дневная,245,8.3,328,Филологический факультет,Филфак,Восточная филология,"д. Калачинск, бул. Мелиоративный, д. 69 к. 3/1, 116094",+7 (534) 018-96-32
Поляков Святослав Гурьевич,2022,дневная,190,7.7,267,Факультет радиофизики и компьютерных технологий,РФиКТ,Кибербезопасность,"с. Тулун, пр. Иркутский, д. 42, 412374",87506481412
тов. Петухов Митофан Измаилович,2023,дневная,212,7.1,283,Механико-математический факультет,ММФ,Механика и математическое моделирование,"ст. Лодейное Поле, пр. Березовый, д. 97 стр. 8/7, 922985",+7 545 919 56 67
