name,admission_year,form_of_study,exams_score,certificate_score,admission_score,faculty_name,faculty_short_name,specialty,address,phone
Сорокин Андроник Гаврилович,2021,дневная,265,7.4,339,Филологический факультет,Филфак,Славянская филология (с русским языком обучения),"с. Красноселькуп, ш. Гаражное, д. 7, 770862",87703224769
Богданов Леонид Всеволодович,2022,дневная,300,9.0,390,Военный факультет,Военфак,Мировая экономика,"к. Плес, бул. Николаева, д. 209 стр. 482, 759076",+7 119 077 37 73
Ксения Леонидовна Казакова,2020,дневная,290,9.8,388,Факультет радиофизики и компьютерных технологий,РФиКТ,Прикладная информатика,"к. Черемхово, ул. Машиностроителей, д. 742 стр. 4, 194679",+7 (935) 568-1806
Сергей Артурович Молчанов,2021,дневная,253,8.7,340,Филологический факультет,Филфак,Славянская филология (с белорусским языком обучения),"п. Ряжск, бул. Ягодный, д. 7/6, 961933",8 929 985 54 54
Лидия Георгиевна Медведева,2020,дневная,268,7.4,342,Факультет социокультурных коммуникаций,ФСК,Дизайн костюма и текстиля,"к. Суздаль, пр. Олимпийский, д. 5 стр. 9, 107480",8 335 333 8283
Орлова Наина Святославовна,2024,дневная,227,9.9,326,Совместный институт БГУ и Даляньского политехнического университета,СИБД,Механика и математическое моделирование,"п. Беломорск, пр. Тамбовский, д. 4 к. 3/5, 758627",+7 (745) 203-52-79
Евпраксия Степановна Рогова,2021,дневная,275,9.4,369,Физический факультет,Физфак,Прикладная физика,"д. Самара, наб. Советская, д. 423, 139123",8 (705) 537-3541
Исидор Валерьянович Тарасов,2022,дневная,299,7.8,377,Химический факультет,Химфак,Химия,"г. Магадан, бул. Казанский, д. 2 к. 9, 210904",+7 (533) 187-2265
Эрнест Теймуразович Щукин,2023,дневная,221,9.0,311,Химический факультет,Химфак,Химия высоких энергий,"ст. Кущевская, алл. Высоцкого, д. 1/5 к. 8/2, 693096",+7 (882) 491-64-33
Еремей Анисимович Поляков,2021,дневная,218,9.0,308,Факультет журналистики,Журфак,Журналистика,"с. Сургут (Хант.), ул. Прудная, д. 3 к. 7/9, 884893",8 (839) 873-6262
Киселев Лаврентий Филимонович,2020,дневная,230,9.1,321,Институт теологии им. святых Мефодия и Кирилла,Институт теологии,Теология,"д. Юрьевец (Иван.), ул. 60 лет Октября, д. 5/3 к. 9, 195538",89339897063
Фролова Оксана Ивановна,2020,дневная,275,9.5,370,Факультет журналистики,Журфак,Информация и коммуникация,"п. Волгодонск, пер. Коммунаров, д. 349 стр. 1/8, 363562",8 174 614 61 09
Зиновьев Стоян Феофанович,2023,дневная,222,9.7,319,Факультет социокультурных коммуникаций,ФСК,Дизайн предметно-пространственной среды,"к. Устюжна, бул. Транспортный, д. 3, 007431",+7 366 743 8440
Елизавета Никифоровна Савельева,2023,дневная,227,7.5,302,Совместный институт БГУ и Даляньского политехнического университета,СИБД,Прикладная физика,"к. Сладково, бул. Матросова, д. 77 к. 3/3, 993821",+7 305 988 48 18
Марина Эдуардовна Ситникова,2020,дневная,277,9.2,369,Экономический факультет,Экономфак,Экономика,"к. Тула, пер. Гагарина, д. 739 к. 2, 921775",+7 297 591 7401
Терентий Всеволодович Мишин,2023,дневная,298,8.9,387,Совместный институт БГУ и Даляньского политехнического университета,СИБД,Мировая экономика,"с. Нальчик, бул. Красных Партизан, д. 1/2, 182406",8 615 759 2615
Мариан Демьянович Алексеев,2024,дневная,289,9.7,386,Филологический факультет,Филфак,Белорусская филология,"д. Глазов, наб. Озерная, д. 80 к. 4/7, 268911",+7 882 966 04 94
Маргарита Феликсовна Александрова,2023,дневная,238,8.9,327,Факультет радиофизики и компьютерных технологий,РФиКТ,Кибербезопасность,"п. Тикси, бул. Безымянный, д. 2 стр. 22, 563907",8 638 669 0400
Маслов Андроник Аксёнович,2021,дневная,223,9.9,322,Биологический факультет,Биофак,Биология,"п. Екатеринбург, пр. Киевский, д. 5 стр. 6, 069244",8 (408) 436-39-62
Бронислав Фомич Лукин,2022,дневная,251,8.9,340,Факультет географии и геоинформатики,ФГиГ,Геоинформационные системы,"ст. Грозный, наб. Высоцкого, д. 7 стр. 360, 528350",8 (285) 910-4729
Марфа Вениаминовна Носкова,2022,дневная,249,8.5,334,Факультет философии и социальных наук,ФФСН,Философия,"с. Златоуст, пер. Почтовый, д. 8 к. 3/1, 614209",+7 (421) 844-49-26
Олимпий Димитриевич Шубин,2023,дневная,244,7.4,318,Факультет географии и геоинформатики,ФГиГ,Космоаэрокартография и геодезия,"п. Егорьевск, ул. Кубанская, д. 6 к. 2/8, 229413",81450181855
Тимофей Феликсович Лихачев,2020,дневная,244,9.4,338,Институт теологии им. святых Мефодия и Кирилла,Институт теологии,Теология,"с. Саров (Морд.), бул. Нефтяников, д. 9/1, 069179",+7 864 575 00 89
Лыткина Галина Ефимовна,2021,дневная,292,9.5,387,Военный факультет,Военфак,Мировая экономика,"п. Беслан, ул. Азовская, д. 7/2 стр. 689, 191205",8 (875) 702-6161
Валентина Валентиновна Баранова,2022,дневная,210,9.3,303,Факультет социокультурных коммуникаций,ФСК,Современные иностранные языки,"г. Южно-Сахалинск, наб. Нахимова, д. 24 стр. 46, 900039",+7 (872) 709-54-75
Лукия Мироновна Архипова,2022,дневная,205,9.4,299,Механико-математический факультет,ММФ,Механика и математическое моделирование,"с. Тарко-Сале, наб. Толбухина, д. 171, 129259",82541632658
Радислав Давыдович Лыткин,2022,дневная,254,8.3,337,Биологический факультет,Биофак,Экология,"п. Ардон, пер. Нефтяников, д. 6/5 к. 29, 257213",+7 208 359 38 90
Павлов Устин Ааронович,2023,дневная,215,9.5,310,Факультет философии и социальных наук,ФФСН,Социология,"г. Радужный, ул. 30 лет Победы, д. 238, 574787",+71301238394
Степанова Прасковья Феликсовна,2020,дневная,196,8.9,285,Военный факультет,Военфак,Мировая экономика,"с. Белореченск, пер. Ломоносова, д. 972, 001270",8 634 649 6493
Варвара Захаровна Зайцева,2020,дневная,290,9.2,382,Химический факультет,Химфак,Химия высоких энергий,"к. Павловский Посад, алл. Рязанская, д. 6, 909467",+7 463 435 8337
Воробьев Яков Арсеньевич,2023,дневная,286,9.8,384,Факультет социокультурных коммуникаций,ФСК,Графический дизайн и мультимедиадизайн,"клх Двинской, ул. Чернышевского, д. 7/5 стр. 91, 972945",8 315 927 3992
Фомин Евстигней Яковлевич,2020,дневная,287,9.8,385,Факультет философии и социальных наук,ФФСН,Социология,"г. Ростов, наб. Крайняя, д. 62, 306378",+7 525 184 9665
Фёкла Максимовна Яковлева,2020,дневная,243,8.6,329,Физический факультет,Физфак,Компьютерная физика,"г. Раменское, пр. Коммуны, д. 182, 031123",8 877 307 61 59
Ефимова Варвара Феликсовна,2020,дневная,257,8.2,339,Военный факультет,Военфак,Международные отношения (специализация – международные отношения в информационной сфере),"клх Белый Яр (Томск.), пр. Красноармейский, д. 335 к. 22, 178901",8 (653) 361-1549
Алексей Вячеславович Никонов,2024,дневная,237,7.1,308,Факультет радиофизики и компьютерных технологий,РФиКТ,Прикладная информатика,"п. Курган, наб. Кленовая, д. 25 стр. 67, 362312",+7 994 375 64 13
Алевтина Степановна Доронина,2024,дневная,276,9.3,369,Факультет прикладной математики и информатики,ФПМИ,Прикладная математика,"г. Верхоянск, ул. Ивановская, д. 9, 929684",8 665 786 5120
Некрасов Сильвестр Гавриилович,2020,заочная сокращенный срок,280,9.5,375,Юридический факультет,Юрфак,Правоведение,"с. Старая Русса, бул. Строителей, д. 1, 809847",+73004062546
Лидия Павловна Федотова,2020,дневная,292,8.2,374,Факультет прикладной математики и информатики,ФПМИ,Прикладная математика,"с. Тобольск, наб. Новая, д. 65 стр. 264, 188820",+7 (647) 111-90-41
Глеб Давидович Никитин,2023,дневная,296,7.9,375,Исторический факультет,Истфак,Архивное дело,"д. Саратов, наб. Лесхозная, д. 19 стр. 8/7, 954335",8 (932) 827-5487
Анисимов Лонгин Трифонович,2022,дневная,268,9.9,367,Факультет радиофизики и компьютерных технологий,РФиКТ,Кибербезопасность,"п. Сыктывкар, алл. Ключевая, д. 3/5 стр. 8/9, 929089",+7 (023) 912-81-54
Надежда Эдуардовна Константинова,2020,дневная,238,8.2,320,Институт теологии им. святых Мефодия и Кирилла,Институт теологии,Теология,"г. Усть-Катав, ш. Заозерное, д. 9, 715877",+7 (635) 785-30-80
Наина Робертовна Стрелкова,2022,дневная,237,8.5,322,Факультет социокультурных коммуникаций,ФСК,Современные иностранные языки,"к. Кирово-Чепецк, бул. Павлика Морозова, д. 809, 362846",8 902 789 61 34
Пимен Августович Анисимов,2022,заочная сокращенный срок,258,9.8,356,Юридический факультет,Юрфак,Правоведение,"п. Карабулак, алл. Орджоникидзе, д. 57, 006869",8 003 740 6472
Виноградова Агата Тимофеевна,2021,дневная,264,7.3,337,Экономический факультет,Экономфак,Государственный аудит,"с. Эльбрус, наб. Гагарина, д. 40, 748128",+7 (183) 862-9904
Ульяна Константиновна Соколова,2022,дневная,251,9.9,350,Экономический факультет,Экономфак,Государственный аудит,"клх Ведено, пр. Кузнечный, д. 1, 050157",8 807 932 33 37
Мирослав Давидович Миронов,2023,дневная,181,9.7,278,Исторический факультет,Истфак,Музейное дело и охрана историко-культурного наследия,"п. Терскол, ш. Красных Партизан, д. 6/7, 892457",8 (417) 760-43-03
Болеслав Валерьянович Евсеев,2021,заочная сокращенный срок,234,8.0,314,Юридический факультет,Юрфак,Правоведение,"к. Апатиты, бул. Покровский, д. 3 стр. 3/4, 921489",80809054100
Гаврилова София Павловна,2020,дневная,271,8.3,354,Исторический факультет,Истфак,Музейное дело и охрана историко-культурного наследия,"ст. Кетченеры, ш. Короткое, д. 5 стр. 2, 045350",8 118 174 5949
Станимир Федосеевич Федоров,2024,дневная,231,7.7,308,Факультет международных отношений,ФМО,Международное право,"с. Завьялиха, наб. Красноярская, д. 26 стр. 4/9, 573753",+7 (117) 321-32-09
тов. Пономарев Семен Абрамович,2021,дневная,227,9.4,321,Филологический факультет,Филфак,Славянская филология (с русским языком обучения),"п. Вилюйск, алл. Ростовская, д. 7/7 стр. 3, 305053",80566998816
тов. Яковлева Василиса Макаровна,2021,дневная,189,9.1,280,Совместный институт БГУ и Даляньского политехнического университета,СИБД,Механика и математическое моделирование,"г. Бреды, ул. Нагорная, д. 4/9 стр. 6, 630623",+76334702619
Всеслав Григорьевич Рябов,2022,дневная,206,7.4,280,Совместный институт БГУ и Даляньского политехнического университета,СИБД,Прикладная физика,"п. Тверь, алл. Баумана, д. 94 к. 3, 937928",+78281978914
Григорьева Прасковья Ивановна,2022,дневная,247,7.1,318,Факультет географии и геоинформатики,ФГиГ,Геотехнологии туризма и экскурсионная деятельность,"ст. Чусовой, пер. Киевский, д. 469, 369914",8 (504) 950-7343
Акулина Максимовна Давыдова,2021,дневная,185,7.8,263,Механико-математический факультет,ММФ,Механика и математическое моделирование,"д. Середниково, наб. Калужская, д. 18 к. 149, 868134",+7 (167) 184-35-40
Василиса Даниловна Зыкова,2022,дневная,202,7.3,275,Экономический факультет,Экономфак,Государственный аудит,"клх Апрелевка, ш. Лесхозное, д. 86, 069172",8 (288) 835-0241
Амос Авдеевич Шашков,2020,дневная,277,7.4,351,Механико-математический факультет,ММФ,Математика и компьютерные науки,"с. Ирбит, алл. 1 Мая, д. 21 к. 4, 141604",+71995327785
Глафира Ниловна Рожкова,2022,дневная,222,8.5,307,Факультет журналистики,Журфак,Журналистика,"г. Талдом, пер. Мостовой, д. 95 к. 63, 337191",82646634264
Элеонора Ефимовна Баранова,2022,дневная,246,8.9,335,Факультет прикладной математики и информатики,ФПМИ,Кибербезопасность,"к. Орехово-Зуево, пр. Орджоникидзе, д. 2 стр. 424, 658590",8 (118) 766-0202
Дроздова Дарья Леоновна,2021,дневная,226,9.0,316,Факультет социокультурных коммуникаций,ФСК,Компьютерное моделирование и разработка веб-приложений,"п. Адыгейск, ш. Рябиновое, д. 603, 308963",+7 (438) 136-21-13
Михеев Изот Матвеевич,2024,дневная,206,10.0,306,Факультет прикладной математики и информатики,ФПМИ,Прикладная информатика,"д. Вуктыл, пер. О.Кошевого, д. 8 стр. 87, 510723",8 (429) 915-4683
Харлампий Дмитриевич Лаврентьев,2021,дневная,200,8.0,280,Факультет международных отношений,ФМО,Международная логистика,"к. Уэлен, алл. Базарная, д. 497, 560058",8 179 725 98 58
Фокин Марк Жоресович,2020,дневная,183,9.5,278,Биологический факультет,Биофак,Экология,"г. Губкин, наб. Космонавтов, д. 75 стр. 1/2, 123287",8 923 276 46 54
Исаков Эмиль Ефремович,2020,дневная,201,9.3,294,Факультет социокультурных коммуникаций,ФСК,Современные иностранные языки,"д. Гагарин, пер. Высоковольтный, д. 98 к. 1, 065215",+7 757 097 0561
Платон Васильевич Антонов,2024,дневная,267,9.3,360,Факультет социокультурных коммуникаций,ФСК,Дизайн предметно-пространственной среды,"ст. Ставрополь, пр. Ермака, д. 3/2 стр. 55, 302231",+79385537299
Трофимова Элеонора Ждановна,2021,дневная,265,9.5,360,Совместный институт БГУ и Даляньского политехнического университета,СИБД,Прикладная физика,"д. Бирск, алл. Коммуны, д. 3, 451201",+7 848 640 8654
Анжела Анатольевна Воронова,2022,дневная,193,8.5,278,Факультет радиофизики и компьютерных технологий,РФиКТ,Интеллектуальная электроника,"п. Плес, ш. Вахитова, д. 501 стр. 60, 807732",8 (601) 070-6875
Иосиф Демьянович Федоров,2020,дневная,231,7.8,309,Экономический факультет,Экономфак,Экономическая информатика,"с. Киржач, пр. Блюхера, д. 8/5 стр. 7, 078789",8 214 571 3913
Фадеев Лаврентий Федосеевич,2023,дневная,292,9.6,388,Факультет международных отношений,ФМО,Международное право,"к. Раменское, алл. Горняцкая, д. 2/7, 403875",8 200 877 3704
Мельников Фадей Феоктистович,2020,второе высшее образование,188,9.0,278,Юридический факультет,Юрфак,Правоведение,"клх Тамбов, наб. Станиславского, д. 32 к. 929, 490267",87553124501
Кудрявцева Ия Никифоровна,2020,дневная,212,8.4,296,Физический факультет,Физфак,Компьютерная физика,"клх Рыльск, пр. Краснодарский, д. 6 к. 707, 497222",+72381092041
Одинцов Эммануил Ефимович,2021,дневная,289,7.9,368,Факультет журналистики,Журфак,Журналистика,"г. Невинномысск, ш. Советов, д. 24 стр. 62, 850934",+7 650 601 04 37
Ирина Леоновна Кулакова,2023,дневная,227,7.5,302,Факультет прикладной математики и информатики,ФПМИ,Прикладная математика,"с. Миллерово, ш. Горное, д. 148, 422546",8 (578) 970-51-09
Борисова Наталья Эльдаровна,2023,дневная,237,9.1,328,Механико-математический факультет,ММФ,Механика и математическое моделирование,"с. Середниково, ул. Бабушкина, д. 1 к. 1, 344155",89331086261
Трофимов Тихон Дорофеевич,2023,дневная,255,7.9,334,Филологический факультет,Филфак,Славянская филология (с русским языком обучения),"ст. Ноябрьск, пер. Прибрежный, д. 31 стр. 2, 876460",8 (004) 039-04-25
Давыд Тихонович Мясников,2023,дневная,241,9.1,332,Факультет международных отношений,ФМО,Мировая экономика,"п. Москва, МГУ, ул. Олега Кошевого, д. 82 стр. 7, 017294",8 900 521 77 98
Исай Анатольевич Лебедев,2022,дневная,279,8.2,361,Факультет прикладной математики и информатики,ФПМИ,Информатика,"п. Барнаул, пр. Чапаева, д. 2/6 стр. 545, 672901",89943511343
Евдокимова Ольга Егоровна,2024,дневная,253,8.4,337,Физический факультет,Физфак,Фундаментальная физика,"д. Троицк (Моск.), бул. Виноградный, д. 837, 504763",8 (197) 807-7461
Эрнест Федотович Кулаков,2023,дневная,279,8.4,363,Механико-математический факультет,ММФ,Математика,"г. Заводоуковск, ш. О.Кошевого, д. 1, 430203",8 (369) 520-3817
Красильникова Варвара Кузьминична,2020,дневная,249,8.5,334,Факультет радиофизики и компьютерных технологий,РФиКТ,Интеллектуальная электроника,"п. Александровск-Сахалинский, бул. Транспортный, д. 458 стр. 7, 395521",+7 040 217 09 69
София Ивановна Федотова,2021,дневная,200,7.3,273,Юридический факультет,Юрфак,Правоведение,"ст. Петухово, пер. Осенний, д. 7 к. 374, 622098",+7 (333) 308-33-96
Фадеев Аверьян Измаилович,2020,дневная,280,7.6,356,Химический факультет,Химфак,Химия лекарственных соединений,"к. Елабуга, ш. Набережное, д. 716 стр. 8/8, 103362",8 (695) 263-45-93
Анна Викторовна Прохорова,2021,дневная сокращенный срок,246,9.4,340,Факультет социокультурных коммуникаций,ФСК,Графический дизайн и мультимедиадизайн,"г. Лотошино, ул. Заречная, д. 5, 775186",+7 (786) 231-7284
Анастасия Валериевна Медведева,2020,дневная,221,7.0,291,Факультет прикладной математики и информатики,ФПМИ,Прикладная математика,"клх Тутончаны, пер. Смирнова, д. 131 к. 8/7, 563959",+7 (628) 671-1079
Гаврилов Викторин Данилович,2021,дневная сокращенный срок,194,8.6,280,Юридический факультет,Юрфак,Правоведение,"с. Курганинск, наб. Ушакова, д. 4/3 к. 6, 550706",86939001403
Никандр Григорьевич Гришин,2023,заочная сокращенный срок,186,9.0,276,Юридический факультет,Юрфак,Правоведение,"п. Сызрань, ул. Ольховая, д. 44 к. 90, 583844",87999056739
Ермолай Виленович Елисеев,2021,заочная сокращенный срок,209,9.5,304,Юридический факультет,Юрфак,Правоведение,"п. Ханты-Мансийск, алл. Войкова, д. 1/2 стр. 51, 667869",8 (269) 162-97-08
