name,admission_year,form_of_study,exams_score,certificate_score,admission_score,faculty_name,faculty_short_name,specialty,address,phone
Ситникова Антонина Николаевна,2023,дневная,201,9.8,299,Военный факультет,Военфак,Мировая экономика,"п. Луховицы, пр. Запрудный, д. 7/9 стр. 90, 093311",+7 (092) 485-08-81
Феврония Ивановна Якушева,2022,дневная,282,8.6,368,Совместный институт БГУ и Даляньского политехнического университета,СИБД,Механика и математическое моделирование,"к. Горно-Алтайск, бул. Республиканский, д. 57 к. 6, 899048",+7 634 519 7906
Ананий Артемьевич Романов,2023,дневная,212,8.8,300,Военный факультет,Военфак,Прикладная физика,"клх Елабуга, алл. Волжская, д. 685 к. 259, 713108",+70293041681
Нестор Теймуразович Иванов,2021,дневная,293,8.2,375,Механико-математический факультет,ММФ,Математика и компьютерные науки,"клх Горно-Алтайск, алл. Осенняя, д. 19, 995865",+7 (051) 947-9184
Волков Дорофей Антонович,2020,дневная,279,8.8,367,Экономический факультет,Экономфак,Финансы и кредит,"ст. Богучар, бул. Вавилова, д. 77 к. 6, 200081",+7 858 488 6852
Герасимова Тамара Андреевна,2021,дневная,226,8.6,312,Факультет философии и социальных наук,ФФСН,Социология,"с. Сухиничи, алл. Прибрежная, д. 8/4, 527312",8 071 105 0415
Гурьева Синклитикия Павловна,2020,дневная,227,7.3,300,Филологический факультет,Филфак,Русская филология,"с. Киренск, пр. Свободы, д. 656 стр. 3/8, 977365",8 (886) 404-99-34
Автоном Федосеевич Третьяков,2022,дневная,227,9.7,324,Факультет международных отношений,ФМО,Менеджмент,"п. Старая Русса, ш. Хвойное, д. 901, 632356",8 (789) 193-9936
Варвара Ильинична Панова,2020,дневная,232,9.0,322,Институт теологии им. святых Мефодия и Кирилла,Институт теологии,Теология,"ст. Батайск, ш. Новоселов, д. 107 к. 33, 886455",8 (409) 961-34-64
Симон Харламович Лебедев,2024,дневная,221,9.9,320,Факультет журналистики,Журфак,Журналистика,"клх Раменское, пер. Короткий, д. 1/8 стр. 332, 580570",88042260052
Панфилов Ипполит Валерьевич,2023,дневная,241,7.0,311,Институт теологии им. святых Мефодия и Кирилла,Институт теологии,Теология,"п. Апатиты, пер. Средний, д. 2/9 стр. 3, 727619",+7 335 996 87 69
Онуфрий Виленович Фокин,2023,дневная,182,8.7,269,Факультет философии и социальных наук,ФФСН,Социология,"п. Валдай, ш. Лунное, д. 44 к. 5, 353010",8 255 307 4110
Ульяна Ивановна Иванова,2020,дневная,195,9.1,286,Химический факультет,Химфак,Химия лекарственных соединений,"клх Миасс, ул. Большевистская, д. 2/2 стр. 5, 607420",+7 831 231 1500
Колобов Казимир Фокич,2022,дневная,300,9.3,393,Исторический факультет,Истфак,Регионоведение,"ст. Зарайск, ул. Чайковского, д. 3 к. 3/6, 503832",+7 039 950 00 00
Мухин Эрнст Юльевич,2024,дневная,213,8.5,298,Биологический факультет,Биофак,Микробиология,"с. Биробиджан, алл. Тамбовская, д. 44 стр. 1, 203250",8 335 998 01 35
Исакова Евпраксия Петровна,2022,дневная,213,7.9,292,Факультет журналистики,Журфак,Журналистика,"с. Благовещенск (Амур.), алл. 60 лет СССР, д. 9 стр. 18, 555618",8 (282) 817-43-63
тов. Новиков Степан Андреевич,2023,дневная,253,8.8,341,Филологический факультет,Филфак,Белорусская филология,"г. Усть-Ишим, наб. Коммунаров, д. 923 к. 387, 950794",8 933 156 0374
Пестов Нестор Богданович,2023,дневная,294,8.5,379,Совместный институт БГУ и Даляньского политехнического университета,СИБД,Прикладная физика,"г. Воскресенск, пер. Ворошилова, д. 20 стр. 337, 870761",8 975 661 4569
Карпов Иосиф Эдгардович,2021,дневная,243,7.9,322,Совместный институт БГУ и Даляньского политехнического университета,СИБД,Механика и математическое моделирование,"клх Гдов, пр. Попова, д. 3 к. 85, 206540",+71472888602
Селиверстова Валентина Олеговна,2022,дневная,215,9.7,312,Физический факультет,Физфак,Фундаментальная физика,"клх Арсеньев, ул. Проезжая, д. 20 стр. 5/1, 940204",+7 784 754 41 51
Любовь Макаровна Жукова,2024,дневная,274,9.4,368,Совместный институт БГУ и Даляньского политехнического университета,СИБД,Мировая экономика,"к. Лагань, алл. Средняя, д. 144, 536728",+7 964 012 96 66
Юрий Андреевич Ильин,2021,дневная,199,9.1,290,Юридический факультет,Юрфак,Экономическое право,"к. Кашира, алл. Клубная, д. 9/7 стр. 201, 890266",+7 986 753 27 45
Сергей Димитриевич Самойлов,2021,дневная,205,9.6,301,Институт теологии им. святых Мефодия и Кирилла,Институт теологии,Теология,"с. Чебоксары, наб. Королева, д. 66, 258468",+7 (597) 736-14-42
тов. Сергеев Архип Андреевич,2022,дневная,222,8.9,311,Совместный институт БГУ и Даляньского политехнического университета,СИБД,Механика и математическое моделирование,"клх Якша, бул. Докучаева, д. 638 стр. 5, 023186",+76228329296
Фёкла Юрьевна Вишнякова,2022,дневная,261,7.1,332,Факультет социокультурных коммуникаций,ФСК,Графический дизайн и мультимедиадизайн,"клх Чита, алл. Путевая, д. 847 к. 752, 134321",8 286 055 5998
Евгения Захаровна Крылова,2022,дневная,240,9.9,339,Юридический факультет,Юрфак,Правоведение,"к. Оленек, пер. Центральный, д. 9 стр. 78, 071587",+7 202 797 6857
Олимпиада Кузьминична Воронцова,2021,дневная,244,7.1,315,Военный факультет,Военфак,Геоинформационные системы (направление - специальные),"клх Оймякон, пр. Моховой, д. 3 к. 63, 041323",8 (553) 526-5997
Соколова Александра Валентиновна,2020,дневная,218,9.0,308,Исторический факультет,Истфак,История,"ст. Шатки, наб. Промышленная, д. 455 к. 3, 973613",84260453684
Калинин Любосмысл Богданович,2024,дневная,251,9.7,348,Юридический факультет,Юрфак,Экономическое право,"клх Снежногорск (Мурм.), ш. Фабричное, д. 114, 707300",8 225 798 35 10
Горбунов Панфил Денисович,2024,дневная,270,7.2,342,Химический факультет,Химфак,Фундаментальная химия,"с. Черкесск, пр. Есенина, д. 740 стр. 90, 974345",8 (904) 248-6489
Лариса Яковлевна Сафонова,2022,дневная,225,8.5,310,Военный факультет,Военфак,Мировая экономика,"к. Шали, наб. Безымянная, д. 9/2 стр. 46, 560816",8 833 256 0068
Акулина Оскаровна Брагина,2021,дневная,181,8.0,261,Факультет географии и геоинформатики,ФГиГ,Страноведение и переводческая деятельность,"д. Махачкала, бул. Главный, д. 29 к. 62, 641671",8 952 389 75 66
Исай Фомич Доронин,2020,дневная,219,9.0,309,Экономический факультет,Экономфак,Экономическая информатика,"ст. Чикола, пер. Чайкиной, д. 207, 730605",+7 (184) 240-69-09
Тарас Жанович Громов,2020,дневная,288,9.1,379,Факультет радиофизики и компьютерных технологий,РФиКТ,Радиофизика и информационные технологии,"к. Приморско-Ахтарск, пр. Аэродромный, д. 93 стр. 2, 889789",+7 549 649 99 14
Исидор Жанович Кошелев,2020,второе высшее образование,210,7.2,282,Факультет философии и социальных наук,ФФСН,Психология,"к. Верхнее Пенжино, ул. Ленская, д. 40 стр. 7/7, 608709",+78329700279
Белоусов Аполлон Антипович,2023,дневная,259,7.9,338,Факультет международных отношений,ФМО,Международные отношения,"с. Калач-на-Дону, ш. Дальнее, д. 60 к. 3, 089685",8 392 824 17 23
Наина Александровна Лаврентьева,2024,дневная,220,9.2,312,Экономический факультет,Экономфак,Экономика,"д. Заводоуковск, пр. 30 лет Победы, д. 95 к. 1/9, 600017",8 (618) 191-08-38
Куликов Поликарп Аверьянович,2021,заочная сокращенный срок,254,9.1,345,Юридический факультет,Юрфак,Правоведение,"д. Мытищи, ул. Крымская, д. 109, 244810",8 996 545 18 31
Регина Мироновна Панфилова,2022,дневная,208,8.8,296,Совместный институт БГУ и Даляньского политехнического университета,СИБД,Мировая экономика,"клх Новый Уренгой, алл. Енисейская, д. 1, 510343",87903741651
Михайлова Василиса Васильевна,2024,дневная,199,8.8,287,Военный факультет,Военфак,"Химия (радиационная, химическая и биологическая защита)","ст. Пятигорск, алл. Чапаева, д. 350 стр. 3/5, 991786",8 (889) 848-0248
Валентина Святославовна Блохина,2022,дневная,228,9.0,318,Механико-математический факультет,ММФ,Компьютерная математика и системный анализ,"к. Ижевск, алл. Союзная, д. 99 стр. 2/8, 950743",8 (671) 569-32-90
Митофан Иларионович Юдин,2020,дневная,261,9.2,353,Факультет международных отношений,ФМО,Международная конфликтология,"клх Тайшет, алл. Чайковского, д. 2 стр. 279, 998954",+7 (561) 599-7274
Устинова Зоя Сергеевна,2020,дневная,236,8.6,322,Экономический факультет,Экономфак,Экономика,"д. Алапаевск, бул. Кошевого, д. 3/1 к. 991, 518443",+7 834 825 82 63
Евсеева Прасковья Ефимовна,2023,дневная,282,7.6,358,Физический факультет,Физфак,Компьютерная физика,"г. Надым, ул. Радужная, д. 1/1 к. 4/7, 596405",+7 698 826 67 40
Фаина Кирилловна Филатова,2021,дневная,230,9.7,327,Химический факультет,Химфак,Химия (научно-педагогическая деятельность),"с. Ясный (Оренб.), алл. Республиканская, д. 97 к. 164, 759607",+79976470624
Антонина Рубеновна Хохлова,2024,дневная,290,8.6,376,Факультет философии и социальных наук,ФФСН,Социология,"к. Медногорск, алл. Геологическая, д. 6/7 к. 4, 013661",8 (260) 996-05-74
Нина Николаевна Пономарева,2023,дневная,287,7.9,366,Исторический факультет,Истфак,Архивное дело,"к. Катайск, алл. Безымянная, д. 436 стр. 9/6, 385756",8 969 651 16 06
Ефремова Ольга Наумовна,2024,дневная,238,9.9,337,Факультет журналистики,Журфак,Журналистика,"д. Шатура, алл. Парижской Коммуны, д. 71, 494702",85449620554
Христофор Игоревич Богданов,2021,дневная,299,9.6,395,Совместный институт БГУ и Даляньского политехнического университета,СИБД,Механика и математическое моделирование,"к. Хатанга, наб. Добролюбова, д. 1/7 стр. 562, 119627",+7 932 192 1649
Ия Вячеславовна Ефимова,2024,дневная,261,7.8,339,Факультет международных отношений,ФМО,Мировая экономика,"д. Торжок, ш. Краснопартизанское, д. 16 стр. 3, 254625",8 (848) 940-02-78
Носова Майя Михайловна,2023,дневная,236,9.8,334,Механико-математический факультет,ММФ,Математика и компьютерные науки,"г. Пенза, пр. Гоголя, д. 2/1 стр. 5, 160980",+71132795381
Захаров Евсей Феоктистович,2020,дневная,190,8.4,274,Химический факультет,Химфак,Химия (научно-педагогическая деятельность),"г. Крымск, алл. 50 лет Победы, д. 154 стр. 61, 111628",8 529 972 65 41
Раиса Кирилловна Орехова,2024,дневная,285,8.4,369,Химический факультет,Химфак,Химия высоких энергий,"ст. Валаам, пер. Песчаный, д. 41 к. 7/7, 007545",8 058 822 93 66
Ираклий Феофанович Субботин,2022,дневная,235,8.9,324,Механико-математический факультет,ММФ,Механика и математическое моделирование,"с. Приморско-Ахтарск, бул. Красина, д. 21 к. 47, 111148",+7 868 866 4818
Гришина Евфросиния Григорьевна,2020,дневная,188,8.3,271,Институт теологии им. святых Мефодия и Кирилла,Институт теологии,Теология,"к. Боровск, пр. Льва Толстого, д. 4/3 стр. 3/6, 304420",8 (598) 186-78-06
Меркушев Трофим Федотович,2022,дневная,209,7.9,288,Факультет географии и геоинформатики,ФГиГ,Геоинформационные системы,"с. Чикола, бул. Рыбацкий, д. 19 стр. 41, 613234",+77070106140
Елизавета Валериевна Зимина,2023,заочная сокращенный срок,258,8.5,343,Исторический факультет,Истфак,Управление документами,"г. Муравленко, бул. Шахтерский, д. 1/8 к. 149, 609535",8 (007) 694-38-39
Мокей Харлампович Алексеев,2023,дневная,252,7.5,327,Механико-математический факультет,ММФ,Математика,"г. Междуреченский, алл. Фестивальная, д. 3/8, 589770",8 877 449 5374
Ефремова Пелагея Викторовна,2020,дневная,227,7.7,304,Механико-математический факультет,ММФ,Математика,"к. Уфа, бул. Короленко, д. 2/1 к. 4/9, 297681",+7 (247) 418-61-42
Федотова Лукия Архиповна,2021,дневная,246,8.9,335,Физический факультет,Физфак,Прикладная физика,"к. Красноуфимск, наб. Кирпичная, д. 64 к. 71, 056925",8 (757) 334-1669
Евдокия Юльевна Филатова,2022,дневная,284,9.1,375,Механико-математический факультет,ММФ,Механика и математическое моделирование,"к. Нурлат, бул. Каштановый, д. 9/2 стр. 3/1, 826021",+7 (799) 218-00-38
Анастасия Кузьминична Савина,2020,дневная,291,8.9,380,Факультет социокультурных коммуникаций,ФСК,Графический дизайн и мультимедиадизайн,"с. Буйнакск, бул. Проточный, д. 50 стр. 991, 986270",+75545511272
Вера Степановна Кабанова,2024,дневная,191,7.1,262,Факультет прикладной математики и информатики,ФПМИ,Кибербезопасность,"ст. Колпашево, ул. Спартака, д. 2/9 стр. 6/5, 551620",84448405912
Кулакова Вера Тимуровна,2021,дневная,228,7.4,302,Военный факультет,Военфак,Международные отношения (специализация – международные отношения в военной сфере),"г. Забайкальск, ш. Раздольное, д. 41 стр. 731, 367370",+7 394 188 3293
Федосий Ярославович Гурьев,2021,дневная,233,9.1,324,Экономический факультет,Экономфак,Экономическая информатика,"к. Ельня, ш. Кутузова, д. 1 стр. 6, 266918",+7 182 232 0262
Регина Олеговна Титова,2021,дневная,258,7.1,329,Факультет радиофизики и компьютерных технологий,РФиКТ,Прикладная информатика,"ст. Анапа, алл. Чапаева, д. 903, 941092",8 (205) 387-32-67
Петров Ерофей Терентьевич,2021,дневная,278,8.4,362,Юридический факультет,Юрфак,Экономическое право,"п. Уэлен, ул. Березовая, д. 7 к. 8/2, 635652",+7 588 063 5661
Владимиров Мечислав Трифонович,2022,дневная,254,8.2,336,Факультет философии и социальных наук,ФФСН,Философия,"клх Хасан, пер. Мусы Джалиля, д. 3/7 стр. 19, 356184",+7 (750) 416-6635
Гордеев Виктор Артемьевич,2022,дневная,217,9.8,315,Факультет прикладной математики и информатики,ФПМИ,Информатика,"ст. Тобольск, ул. 30 лет Победы, д. 945 к. 452, 962185",+7 (852) 600-76-35
Родионов Добромысл Брониславович,2020,дневная,214,8.4,298,Факультет географии и геоинформатики,ФГиГ,Геоинформационные системы,"к. Углич, наб. Маркса, д. 266 к. 60, 367799",8 (957) 729-01-07
Ия Семеновна Осипова,2023,дневная,281,8.6,367,Физический факультет,Физфак,Ядерные физика и технологии,"г. Тутончаны, ш. Мичурина, д. 3/4 к. 4/8, 068756",8 (117) 835-83-25
Кудряшов Кирилл Евсеевич,2023,дневная,208,8.2,290,Механико-математический факультет,ММФ,Механика и математическое моделирование,"п. Чита, наб. Менделеева, д. 4, 219981",+7 681 380 88 94
Полина Степановна Голубева,2021,дневная,221,7.9,300,Биологический факультет,Биофак,Биохимия,"к. Красногорск (Моск.), ул. Комсомольская, д. 290 стр. 81, 816004",+7 (640) 920-0384
Корнилова Анжелика Руслановна,2020,дневная,216,8.0,296,Факультет социокультурных коммуникаций,ФСК,Переводческое дело,"п. Ершов, ул. Суворова, д. 475, 898692",8 (934) 960-2541
Филатова Ульяна Мироновна,2024,дневная,249,7.4,323,Экономический факультет,Экономфак,Международная экономика и торговля (с углубленным изучением китайского языка),"с. Гаврилов-Ям, ш. Ульянова, д. 67, 970075",+7 (469) 407-7435
Агата Георгиевна Власова,2024,дневная,253,9.6,349,Физический факультет,Физфак,Компьютерная физика,"клх Уфа, ш. Сиреневое, д. 1 стр. 763, 230871",+76960562402
Жанна Макаровна Антонова,2020,дневная,248,8.1,329,Факультет социокультурных коммуникаций,ФСК,Дизайн костюма и текстиля,"с. Югорск, алл. Павлова, д. 4/5, 707793",8 (088) 595-39-41
Князева Александра Дмитриевна,2021,дневная,274,7.1,345,Исторический факультет,Истфак,Управление документами,"д. Чикола, бул. О.Кошевого, д. 4/7 стр. 550, 410479",8 649 686 6224
Антонина Федоровна Маркова,2020,дневная,227,8.3,310,Институт теологии им. святых Мефодия и Кирилла,Институт теологии,Теология,"с. Бронницы, ш. Космодемьянской, д. 837, 323617",8 (541) 149-2578
Олимпиада Геннадиевна Большакова,2024,дневная,273,8.5,358,Факультет международных отношений,ФМО,Мировая экономика,"ст. Аша, пер. Главный, д. 8 стр. 9/4, 958498",+72529173258
Глафира Романовна Борисова,2020,дневная,242,9.0,332,Экономический факультет,Экономфак,Международная экономика и торговля (с углубленным изучением китайского языка),"с. Набережные Челны, алл. Железнодорожная, д. 15 стр. 301, 088224",8 479 289 79 80
Симонов Аполлинарий Афанасьевич,2022,дневная,194,8.9,283,Факультет социокультурных коммуникаций,ФСК,Дизайн костюма и текстиля,"клх Ханты-Мансийск, пр. Нижний, д. 895 стр. 5, 400726",8 913 587 52 45
Пестова Анжелика Филипповна,2020,дневная,246,8.0,326,Факультет радиофизики и компьютерных технологий,РФиКТ,Прикладная информатика,"п. Усть-Ордынский, наб. Полярная, д. 4/4, 276464",+7 900 622 2147
Самсонова Евгения Наумовна,2024,дневная,181,7.9,260,Совместный институт БГУ и Даляньского политехнического университета,СИБД,Механика и математическое моделирование,"клх Каспийск, бул. Слободской, д. 1/1 к. 8, 303692",8 (408) 157-26-10
Демид Артёмович Зыков,2021,дневная,299,7.6,375,Институт теологии им. святых Мефодия и Кирилла,Институт теологии,Теология,"д. Радужный, ул. Февральская, д. 8, 146548",80746003554
Ермолай Геннадиевич Лукин,2023,дневная,264,9.3,357,Институт теологии им. святых Мефодия и Кирилла,Институт теологии,Теология,"г. Минусинск, ул. Островского, д. 41 к. 84, 427252",+7 215 472 5365
